{
  "schemaVersion": "0.1.0",
  "grantId": "11111111-1111-4111-8111-111111111111",
  "selectedMaterialConfirmed": true,
  "selection": {
    "purpose": "FINDING_EXPLANATION",
    "scanJobId": "22222222-2222-4222-8222-222222222222",
    "reportSha256": "aaaaaaaaaaaaaaaaaaaaaaaaaaaaaaaaaaaaaaaaaaaaaaaaaaaaaaaaaaaaaaaa",
    "prHeadRevisionId": null,
    "findingIds": [
      "11111111-1111-4111-8111-111111111111"
    ],
    "documentVersionIds": []
  }
}
